921,2025-08-07,"US to rewrite its past national climate reports, furthering its efforts to undermine the scientific consensus on human-caused global warming.",https://www.france24.com/en/live-news/20250807-us-to-rewrite-its-past-national-climate-reports,No,No,No,Yes,Yes,No,No,No,No,No
919,2025-08-07,"US government plans to incinerate $9.7 mio in already purchased birth control pills and conttraceptives after USAID shut down, despite other orgnaisations offering to distribute them at no cost to the US",https://www.nytimes.com/2025/08/07/world/europe/usaid-contraceptives-trump.html,No,No,No,No,Yes,No,No,No,Yes,No
917,2025-08-07,UCLA says the Trump administration froze $584mio of its federal funding,https://www.reuters.com/legal/government/ucla-says-trump-administration-froze-584-million-its-federal-funding-2025-08-06/,No,No,No,No,Yes,No,No,No,No,No
916,2025-08-07,"Trump to sign EO requiring all universities to disclose admissions data on race to prove that they are not engaged in ""affirmative action""",https://www.reuters.com/legal/government/trump-sign-order-requiring-universities-disclose-admissions-data-race-2025-08-07/,No,No,No,No,No,Yes,No,No,No,No
906,2025-08-07,"Energy Sectretary suggests that the administration are updating previously published National Climate Assessments, saying previus reports ""weren’t fair in broad-based assessments of climate change.”",https://edition.cnn.com/2025/08/07/climate/wright-national-climate-assessments-updating,No,No,No,No,Yes,No,No,No,No,No
902,2025-08-06,"RFK Jr's. (Kennedy) Health department to halt $500m in mRNA vaccine research, questioning its safety.",https://apnews.com/article/kennedy-vaccines-mrna-pfizer-moderna-1fb5b9436f2957075064c18a6cbbe3c9,No,No,No,No,Yes,No,No,No,No,No
889,2025-08-05,EPA moves to cancel $7billion in grants for solar energy (intended to help low and moderate income families install solar panels),https://www.nytimes.com/2025/08/05/climate/epa-cancels-solar-energy-grants.html,No,No,No,No,Yes,No,No,No,No,No
883,2025-08-04,"The Trump administration has asked NASA employees to draw up plans to end at least two major satellite missions designed and built specifically to monitor planet-warming greenhouse gases. The data they collect is widely used, including by scientists and farmers",https://www.npr.org/2025/08/04/nx-s1-5453731/nasa-carbon-dioxide-satellite-mission-threatened,No,No,No,No,Yes,No,No,No,No,No
876,2025-08-03,"Secretary of Health RFK Jr (Kennedy) publishes a non-peer reviewed article alleging harm from aluminium salts in vaccine products that is not based on scientific evidence, and could be a prelude to banning vaccines (including many routine childhood vaccines) that continain aluminium salts",https://rasmussenretorts.substack.com/p/aluminum-standard-science,No,No,No,No,Yes,No,No,No,No,No
868,2025-08-01,"Trump freezes $200 million in UCLA science and medical research funding, citing antisemitism",https://ca.news.yahoo.com/trump-freezes-200-million-ucla-035213794.html,No,No,No,No,No,Yes,No,No,No,No
866,2025-08-01,"Trump administration blocks funding for CDC programs including youth violence prevention programs, gun injury and death and programs tackling diabetes and tobacco use",https://www.msn.com/en-us/news/politics/trump-administration-blocks-funding-for-cdc-health-programs/ar-AA1JKDpv,No,No,No,No,Yes,No,No,No,No,No
862,2025-08-01,"American Medical Association (AMA), American Academy of Pediatrics and Infectious Disease Society of America are kicked out of ACIP (Advisory Comittee on Immunization Practices) workgroups at CDC (Centers for Disease Control and Prevention)",https://apnews.com/article/vaccine-committee-cdc-cfbdcab84b2a919a6131d471959c3431,No,No,No,No,Yes,No,No,No,No,No
861,2025-08-01,"A researcher on a green card at Texas A&M University flying home from abroad was detained for more than a week by immigration authorities at the San Francisco International Airport, sleeping in a chair and living off food sold in the airport. Kim, who went to South Korea to attend his brother’s wedding, is now in removal proceedings to be deported. Neither he nor his lawyers know why.",https://apnews.com/article/texas-researcher-detained-san-francisco-airport-d038b3cca949f0f028eb9e17d350a79a,No,No,No,No,No,Yes,Yes,No,No,Yes
858,2025-07-31,Trump administration's Bureau of Ocean Energy Management cancels off-shore wind projects,https://apnews.com/article/trump-wind-permitting-offshore-7a05dff77ba92e4a7761604583a6d208,No,No,No,No,Yes,No,No,No,No,No
857,2025-07-31,"Trump administration has sent letter to Harvard referring it to the Department of Justice in civil rights probe to address allegations of Harvard""s antisemitic discrimination",https://www.reuters.com/legal/government/trump-administration-refers-harvard-justice-department-civil-rights-probe-2025-07-31/,No,No,No,No,No,Yes,No,No,No,No
853,2025-07-31,"Former vaccine panel ousted by RFK (Kennedy) Jr. says scientific rigor is ""rapidly eroding""",https://www.cbsnews.com/news/acip-vaccine-panel-ousted-by-rfk-jr-speaks-out/,No,No,No,No,Yes,No,No,No,No,No
852,2025-07-31,"Environment Protection Agency (EPA) moves ahead with plans to undo almost all UC climate regulations by rescinding the ""endangerment finding""",https://www.theguardian.com/environment/2025/jul/31/trump-epa-endangerment-finding,No,No,No,No,Yes,No,No,No,No,No
851,2025-07-31,Energy Department attacks climate science in new contentious report criticising the consensus on global wamring,https://www.nytimes.com/2025/07/31/climate/trump-climate-skeptics-science-report.html,No,No,No,No,Yes,No,No,No,No,No
843,2025-07-30,"Brown University reaches deal with Trump administration to restore $50m in funds and will commit to nondiscrimination in admissions and campus programs, and grant officials access to its admissions data. Brown says the government does not have the authority to dictate teaching, learning and academic speech",https://www.theguardian.com/us-news/2025/jul/30/brown-university-trump-administration-agreement,No,No,No,No,No,Yes,No,No,No,No
842,2025-07-30,Army Secretary withdraws a publicised West Point distinguished professorship appointment from former Biden official amid pressure from right wing activist Laura Loomer,https://edition.cnn.com/2025/07/30/politics/army-secretary-withdraws-west-point-job-offer,Yes,No,Yes,No,Yes,No,No,No,No,No
841,2025-07-30,"A new Department of Energy (DoE) report “fundamentally misrepresents” climate research and leaves out key context, say multiple scientists cited in the report",https://www.wired.com/story/scientists-say-new-government-climate-report-twists-their-work/,No,No,No,No,Yes,No,No,No,No,No
838,2025-07-29,"The Trump administration has frozen $108m in federal National Institute of Health (NIH) research funding to Duke University after the federal government announced that it was investigating allegations that the school engaged in racial discrimination in the form of affirmative action,",https://www.theguardian.com/us-news/2025/jul/30/white-house-duke-university-racial-discrimination,No,No,No,No,No,Yes,No,No,No,No
832,2025-07-29,Harvard to comply with Trump official's demands to turn over employment forms,https://www.theguardian.com/education/2025/jul/29/harvard-trump-administration-employment-forms,No,No,No,No,No,Yes,Yes,No,No,No
830,2025-07-29,Department of the Interior scraps preferential treatment for wind energy,https://www.doi.gov/pressreleases/department-interior-curbs-preferential-treatment-wind-energy,No,No,No,No,Yes,No,No,No,No,No
828,2025-07-29,Department of Education (DOE) and Dept of Health and Human Services (HHS) investigating Duke University and the Duke Law Journal over race-related discrimination allegations.,https://thehill.com/homenews/education/5425285-trump-administration-duke-university-race-discrimination-allegations/,No,No,No,No,No,Yes,No,No,No,No
825,2025-07-28,The National Science Foundation (NSF) plans to abruptly end operation of the last remaining US research ship capable of braving the farthest reaches of Antarctica and the Southern Ocean. It supports crucial climate change research,https://www.science.org/content/article/nsf-plans-abrupt-end-lone-u-s-antarctic-research-icebreaker,No,No,No,No,Yes,No,No,No,No,No
824,2025-07-28,"RFK Jr. targets vaccine injury compensation program (VICP) saying ""I will not allow the VICP to continue to ignore its mandate and fail its mission of quickly and fairly compensating vaccine-injured individuals,""",https://www.nytimes.com/2025/07/28/health/kennedy-vaccine-injury-court.html,No,No,No,No,Yes,No,No,No,No,No
822,2025-07-28,Harvard contemplating spending up to $500 Million to placate Trump White House,https://www.nytimes.com/2025/07/28/us/politics/trump-harvard-payment.html,No,No,No,No,No,Yes,No,No,No,No
819,2025-07-26,"With Columbia as a model, White House seeks fines in potential deals with Harvard and others",https://apnews.com/article/harvard-columbia-trump-university-fines-settlement-template-4a39b2894f08beffcff5da4971585710,No,No,No,No,No,Yes,No,No,No,No
817,2025-07-26,NASA says about 20% of staff to leave the agency,https://www.reuters.com/business/world-at-work/nasa-says-20-workforce-depart-space-agency-2025-07-26/,No,Yes,No,No,Yes,No,No,No,No,No
816,2025-07-26,"Donald Trump calls illegal migration a ""horrible invasion"" that is ""killing Europe"" and also attacks European wind farms on a trip to Scotland",https://news.sky.com/story/immigration-is-killing-europe-donald-trump-issues-warning-to-leaders-as-he-arrives-in-scotland-13401882,No,No,No,No,Yes,No,No,No,Yes,No
807,2025-07-25,"RFK Jr. (Kennedy) to Oust Advisory Panel on Cancer Screenings, HIV Prevention Drugs. The panel determines which preventive services insurers must cover at no cost to patients",https://www.wsj.com/health/healthcare/rfk-health-screening-panel-members-c308cbb0,No,No,No,No,Yes,No,No,No,No,No
806,2025-07-25,Outcry as US agriculture department to cut salaries and relocate staff. Experts warn ‘half-baked’ restructuring will further erode support for US farmers and hamper wildfire response,https://www.theguardian.com/us-news/2025/jul/24/usda-salary-cuts,No,Yes,No,No,Yes,No,No,No,No,No
801,2025-07-25,Department of Education (DOE) says five school districts in Democratic-leaning Northern Virginia were violating federal law by allowing transgender students to use bathrooms and other facilities matching their gender identity.,https://www.reuters.com/legal/government/us-government-says-virginia-school-gender-policies-unlawful-2025-07-25/,No,No,No,No,No,Yes,Yes,No,No,No
800,2025-07-25,"Consent decrees meant to curb police abuse are ending in more than 20 cities, including Breonna Taylor’s Louisville, after Department of Justice (DoJ) announced a reversal in investigations and consent decrees in May",https://www.theguardian.com/us-news/2025/jul/25/trump-ends-police-reform-consent-decrees,No,No,No,No,Yes,No,Yes,No,No,No
798,2025-07-24,"Trump administration, in an emergency appeal, asks Supreme Court to allow NIH (National Institutes of Health) to cut funding for grants related to Diversity, Equity and Inclusion (DEI)",https://www.nytimes.com/2025/07/24/us/politics/trump-supreme-court-nih-dei-grants.html,No,No,No,No,Yes,No,No,No,No,No
797,2025-07-24,"The White House is seeking fines from several universities it says failed to stop antisemitism on campus, including hundreds of millions of dollars from Harvard University, in exchange for allowing the schools to access federal funding",https://www.wsj.com/us-news/education/harvard-columbia-trump-white-house-fines-payment-deal-settlement-d61aa9c6,No,No,No,No,No,Yes,No,No,No,No
796,2025-07-24,"Senate confirms Trump's EPA air office nominee Aaron Szabo, a former lobbyist who has links to the oil industry and is a co-author in a chaper of Project 25 on dismantling the EPA",https://subscriber.politicopro.com/article/eenews/2025/07/24/senate-confirms-trumps-epa-air-office-nominee-00473029,No,No,No,No,Yes,No,No,No,No,No
793,2025-07-24,Environmental Protection Agency (EPA) seeks to bring back twice-already banned pesticide,https://www.newsweek.com/epa-seeks-bring-back-twice-banned-pesticide-2103447,No,No,No,No,Yes,No,No,No,No,No
792,2025-07-24,"Environmental Protection Agency (EPA) rescinds $20m for clean water in pesticide-riden rural California claiming it is a ""wasteful DEI program""",https://www.theguardian.com/us-news/2025/jul/24/water-pesticide-polution-california-trump,No,No,No,No,Yes,No,No,No,No,No
790,2025-07-24,"Columbia University will pay $200m to the federal government over accusations it failed to protect its Jewish students and “not maintain programs that promote unlawful efforts” related to diversity, equity and inclusion (DEI). Settlement allows federal govt oversight into its admissions. In return govt will restart some grants to Columbia",https://www.bbc.co.uk/news/articles/cq8zljpvyk0o,No,No,No,No,No,Yes,No,No,No,No
788,2025-07-24,"Artist, famous for her portrait of Michelle Obama, cancels show at Smithsonian citing censorship, after learning that her painting of a transgender Statue Of Liberty might be removed to avoid provoking Trump",https://www.nytimes.com/2025/07/24/arts/design/amy-sherald-smithsonian-censorship.html,No,No,No,No,No,Yes,No,No,No,No
787,2025-07-23,"US AI action plan ""continues this crusade against “woke” AI, recommending that federal procurement guidelines are updated so that only AI companies that “ensure that their systems are objective and free from top-down ideological bias” are given contracts.""",https://www.wired.com/story/trumps-ai-action-plan-crusade-against-bias-regulation/,No,No,No,Yes,Yes,No,Yes,No,No,No
784,2025-07-23,"The Environmental Protection Agency (EPA) has drafted a proposal to reverse a landmark scientific finding that climate change pollution from fossil fuels endangers human health ('the endangerment finding'), which would reduce EPA's ability to limit greenhouse gas producing industry",https://edition.cnn.com/2025/07/23/climate/epa-greenhouse-gas-endangerment,No,No,No,No,Yes,No,No,No,No,No
782,2025-07-23,State Department Opens New Investigation Into Harvard’s Use of International Visas,https://www.nytimes.com/2025/07/23/us/politics/state-department-trump-harvard.html,No,No,No,No,No,Yes,No,No,No,No
781,2025-07-23,RFK Jr to remove preservative thimerosal from all US vaccines . Anti-vaccine campaigns have targeted thimerosal for decades despite no evidence of ingredient causing harm,https://www.theguardian.com/politics/live/2025/jul/24/keir-starmer-narendra-modi-uk-india-trade-deal-labour-politics-latest-updates-news,No,No,No,No,Yes,No,No,No,No,No
779,2025-07-23,Congress voted to restore $400 million for the federal program to combat HIV in developing nations (PEPFAR) but that may be short-lived: Officials at the State Department have been mapping out a plan to shut it down anyway,https://www.nytimes.com/2025/07/23/health/pepfar-shutdown.html,No,No,No,No,Yes,No,No,No,Yes,No
769,2025-07-22,"The Harvard Educational Review academic journal abruptly cancels entire special issue on Education and Palestine shortly before release, ""a remarkable new development in a mounting list of examples of censorship of pro-Palestinian speech""",https://www.theguardian.com/education/2025/jul/22/harvard-educational-review-palestine-issue-cancelled,No,No,Yes,Yes,Yes,No,No,No,No,No
755,2025-07-21,"Trump attacks federal judge presiding over Harvard case and also attacks Harvard as “anti-Semitic, anti-Christian, and anti-America,”",https://www.politico.com/news/2025/07/21/trump-harvard-case-judge-00465755,Yes,No,Yes,No,No,Yes,No,No,No,No
746,2025-07-18,Trump administration to destroy nearly $10m in contraceptives that were intended for women in Africa,https://www.theguardian.com/us-news/2025/jul/18/trump-administration-destroy-contraceptives-usaid-africa,No,No,No,No,Yes,No,No,No,Yes,No
744,2025-07-18,"Plan for ""infertility training centre"" as birth control program signals new approach to helping women get pregnant taking funds from program that provided low-income women with birth control (Title X)",https://www.nytimes.com/2025/07/18/us/politics/under-trump-a-new-focus-for-a-birth-control-program-helping-women-get-pregnant.html,No,No,No,No,Yes,No,No,No,No,No
743,2025-07-18,Head of the Bureau of Consular Affairs says that criticism of Israel can lead to visa revocations,https://www.nytimes.com/2025/07/18/us/politics/us-visa-revocations-israel.html,No,No,Yes,No,No,Yes,Yes,No,Yes,No
742,2025-07-18,"Environmental Protection Agency (EPA) says it will dismantle its scientific research arm. The EPA's science office has provided the independent research that underpins nearly all of the agency’s policies and regulations. It has analyzed the risks of hazardous chemicals, the impact of wildfire smoke on public health and the contamination of drinking water by hydraulic fracturing, or fracking",https://www.nytimes.com/2025/07/18/climate/epa-firings-scientific-research.html,No,Yes,No,No,Yes,No,No,No,No,No
738,2025-07-18,"Conservative legal group America First Legal ( founded and run by Trump advisor Stephen Miller) has filed a complaint to Dept of Justice (DoJ) against Johns Hopkins Universiy School of Medicine, alleging racial discrimination",https://www.thebaltimorebanner.com/education/higher-education/johns-hopkins-medical-school-america-first-legal-conservative-complaint-C4UMKITWIRDZVE7BN2SFDPGNB4/,No,No,No,No,No,Yes,No,No,No,No
729,2025-07-17,"A new study reveals that many government health datasets have been changed without public notice, raising concerns about scientific integrity and the impact on research",https://academyhealth.org/blog/2025-07/academyhealths-situation-report-substantial-changes-datasets-allocations-fy26-announced,No,No,No,Yes,Yes,No,No,No,No,No
725,2025-07-16,FDA chief medical and scientific officer Prasad again overrides FDA vaccine reviewers on Moderna COVID-19 vaccination for children,https://www.biospace.com/fda/vinay-prasad-overruled-reviewers-on-modernas-covid-19-shot-for-kids,No,No,No,No,Yes,No,No,No,No,No
723,2025-07-15,US nuclear regulator (USNRC) asks job seekers political questions,https://www.reuters.com/legal/government/us-nuclear-regulator-asks-job-seekers-political-questions-2025-07-14/,Yes,No,No,No,Yes,No,No,No,No,No
721,2025-07-15,"Trump official (Russell Vought, director of the Office of Management and Budget (OMB)) falsely accused PEPFAR (providing HIV treatment overseas) of funding abortions in Russia",https://www.nytimes.com/2025/07/15/health/trump-official-pepfar-funding-abortions-russia.html,No,No,No,Yes,Yes,No,No,No,No,No
720,2025-07-15,Trump administration's Dept of Education (DOE) investigates University of Michigan over forgeign funds,https://www.nytimes.com/2025/07/15/us/politics/trump-michigan-university-foreign-funding.html,No,No,No,No,No,Yes,No,No,No,No
718,2025-07-15,Trump administration (EPA) withdraws $15m in research into PFAs (forever chemicals),https://www.theguardian.com/us-news/2025/jul/11/trump-pfas-research-funding-farms,No,No,No,No,Yes,No,No,No,No,No
713,2025-07-14,Senator Rand Paul Re-Refers Dr. Anthony Fauci to the Department of Justice for investigation,https://www.hsgac.senate.gov/media/reps/senator-rand-paul-re-refers-dr-anthony-fauci-to-the-department-of-justice/,No,No,Yes,No,Yes,No,No,No,No,No
712,2025-07-14,National Institutes of Health (NIH) to dismiss dozens of grant reviewers to align with Trump administration's priorities,https://www.nature.com/articles/d41586-025-02221-6,No,No,No,No,Yes,No,No,No,No,No
710,2025-07-14,"Department of Health and Human Services (HHS) fires 1000s across health, democracy and human traficking agencies",https://edition.cnn.com/2025/07/14/health/hhs-layoffs-supreme-court,No,Yes,No,No,Yes,No,No,No,No,No
700,2025-07-12,"Billionaire Tech Advisor to Trump says universities will ""pay the price"" for DEI and calls for the National Science Foundation (NSF) to receive the ""bureaucratic death penalty""",https://www.washingtonpost.com/technology/2025/07/12/marc-andreessen-private-chat-universities-diversity/,No,No,No,No,Yes,Yes,No,No,No,No
699,2025-07-12,Attorney General Pam Bondi announces dismissal of charges against plastic surgeon who destroyed Covid vaccines and charged for fake CDC Covid vaccination cards,https://www.cbsnews.com/news/pam-bondi-dismissal-charges-against-utah-plastic-surgeon-michael-kirk-moore-faking-covid-19-vaccine/,Yes,No,No,No,Yes,No,No,No,No,No
697,2025-07-11,"US Education Department (DOE) launches investigation into Minnesota 's George Mason University over DEI practices and the Department of Justice (DOJ) opened and investigation into Minnesota, including its Department of Health and Human Services",https://www.reuters.com/legal/government/us-probes-minnesota-george-mason-university-over-dei-hiring-practises-2025-07-10/,No,No,Yes,No,No,Yes,No,No,No,No
694,2025-07-11,"Republican Senator Justice successfully pushed for coal subsidy that personally benefits himself & family, while damaging climate goals. as part of ""Big Beautiful Bill""",https://www.eenews.net/articles/how-a-new-coal-credit-snuck-into-the-gop-megabill/,No,No,No,No,Yes,No,No,Yes,No,No
691,2025-07-11,Enviroment Protection Agency (EPA) to cut funding to solar and wind projects,https://www.nytimes.com/2025/07/11/business/energy-environment/energy-department-renewable-funding-cuts.html,No,No,No,No,Yes,No,No,No,No,No
687,2025-07-10,"NIH (National Institute of Health) director, Jay Bhattacharya, is replacing his top independent advisory board, the Advisory Committee to the director (ACD)",https://www.science.org/content/article/nih-director-replacing-his-top-outside-advisory-board,No,No,No,No,Yes,No,No,No,No,No
686,2025-07-10,Dept of Homeland Security (DHS) cancels extreme weather communcations grant while rescue efforts in Texas floods are ongoing,https://talkingpointsmemo.com/edblog/dhs-cancels-extreme-weather-comms-grant-while-bodies-still-being-recovered-in-texas,No,No,No,Yes,Yes,No,No,No,No,No
684,2025-07-09,Trump sues California about transgender athletes in girls' school sports,https://www.theguardian.com/us-news/2025/jul/09/trump-sues-california-over-transgender-athletes-in-girls-school-sports,No,No,No,No,No,Yes,Yes,No,No,No
681,2025-07-09,Trump administration renews pressure on Harvard with administrative subpeonas issued by DHS and threatens accreditation (core to university function),https://www.nytimes.com/2025/07/09/us/politics/trump-harvard-data-accreditation.html,No,No,No,No,No,Yes,No,No,No,No
679,2025-07-09,RFKJr (Kennedy) abruptly cancels USPFTS (US PReventive Services Task Force) meeting,https://www.medpagetoday.com/washington-watch/washington-watch/116435,No,No,No,No,Yes,No,No,No,No,No
678,2025-07-09,Recipients of US Climate Science Fellowship are put on unpaid leave,https://www.nytimes.com/2025/07/09/climate/noaa-fellows-unpaid-leave.html,No,No,No,No,Yes,No,No,No,No,No
677,2025-07-09,over 2000 senior staff due to leave NASA,https://www.politico.com/news/2025/07/09/nasa-staff-departures-00444674,No,Yes,No,No,Yes,No,No,No,No,No
676,2025-07-09,HHS (Health and Human Services) backtracks on pledge to disclose confilcts of interest for new ACIP (Vaccine advisory panel) members appointed my RFK,https://www.statnews.com/2025/07/09/kennedy-conflict-of-interest-radical-transparency-acip-vaccine-experts/,No,No,No,No,Yes,No,No,No,No,No
675,2025-07-09,Dept of Justice (DOJ) subpeonas nearly 20 clinics over gender-affirming care,https://www.statnews.com/2025/07/09/doj-issues-subpoenas-related-to-gender-affirming-care/,No,No,No,No,Yes,No,Yes,No,No,No
668,2025-07-07,"US funding cuts threaten academic science jobs in the US at all levels, particularly early career researchers: e.g. the number of early-career researchers ithe National Science Foundation (NSF) supports could fall by 78%",https://www.science.org/content/article/it-s-nightmare-u-s-funding-cuts-threaten-academic-science-jobs-all-levels,No,No,No,No,Yes,Yes,No,No,No,No
660,2025-07-04,"EPA puts 139 employees on leave after thy sign a ""declaration of Dissent""",https://www.theguardian.com/us-news/2025/jul/03/epa-employees-administrative-leave,No,No,Yes,No,Yes,No,No,No,No,No
658,2025-07-03,"Trump EO creates ""Make America Beautiful"" commission to “promote responsible stewardship of natural resources while driving economic growth” on historically protected public land.",https://www.nytimes.com/2025/07/03/us/politics/trump-executive-order-maba-public-land.html,No,No,No,No,Yes,No,No,No,No,No
650,2025-07-02,"Records show Prasad, FDA's new chief medical and scientific officer, rejected the recommendations of agency experts and limited the use of Covid vaccines.",https://www.nytimes.com/2025/07/02/health/fda-covid-vaccines.html,No,No,No,No,Yes,No,No,No,No,No
644,2025-07-01,Trump team axes contracts with publishing giant Springer Nature,https://www.nature.com/articles/d41586-025-02080-1,No,No,No,No,Yes,No,No,No,No,No
640,2025-07-01,"Trump administration withholds, without explanation, $7bn for schools allocated by Congress",https://www.nytimes.com/2025/07/01/us/trump-education-funds.html,Yes,No,No,No,No,Yes,No,No,No,No
639,2025-07-01,"In a deal with Trump administration the University of Pennsylvania agrees to limit participation of transgender athletes in sport and adopt biology-based definitions of the words ""male"" and ""female"".",https://www.nytimes.com/2025/07/01/us/penn-title-ix-transgender-swimmer-trump.html,No,No,No,No,No,Yes,Yes,No,No,No
634,2025-06-30,Trump administration says Harvard risks ‘loss of all federal resources’ due to alleged campus antisemitism,https://www.politico.com/news/2025/06/30/trump-harvard-federal-funding-antisemitism-00432450,No,No,No,No,No,Yes,No,No,No,No
631,2025-06-30,"All US National Clilmate Assessments (mandated by Congress every 4 years) taken offline, as well as the US Global Change Research Program Website",https://bsky.app/profile/katharinehayhoe.com/post/3lstz5lu4rs27,No,No,No,No,Yes,No,No,No,No,No
