"Trump Action Tracker — ©️ The authors Christina Pagel, Creative Commons CC BY 4.0 license (data) (site content). Source: trumpactiontracker.info. (Accessed on 2025-11-07)"

Index,Date,Title,URL,Violating Democratic Norms, Undermining Rule of Law,Hollowing State / Weakening Federal Institutions,Suppressing Dissent / Weaponising State Against 'Enemies',Controlling Information Including Spreading Misinformation and Propaganda,Control of Science & Health to Align with State Ideology,Attacking Universities, Schools, Museums, Culture,Weakening Civil Rights,Corruption & Enrichment,Aggressive Foreign Policy & Global Destabilisation,Anti-immigrant or Militarised Nationalism
1682,2025-10-31,"No high-level US representative to attend UN's COP30 climate talks. The US has always sent delegations of various sizes to UN climate summits over the past three decades, even during periods under George W Bush and in Donald Trump’s first term. This decision underscores administration’s hostility to climate action",https://www.theguardian.com/environment/2025/oct/31/cop30-climate-us-officials,No,No,No,No,Yes,No,No,No,Yes,No
1673,2025-10-30,"Access to gender-affirming care for transgender youth will be dramatically restricted by the Trump administration under new proposals by the Department of Health and Human Services. Both supporters and opponents of transgender rights agree that, if implemented, the proposals could make access to pediatric gender-affirming care across the country extremely difficult, if not impossible",https://www.npr.org/sections/shots-health-news/2025/10/30/nx-s1-5588655/transgender-trump-medicare-medicaid-gender-affirming-care,No,No,No,No,Yes,No,Yes,No,No,No
1672,2025-10-30,"Most of the government editorial staff at ""Preventing Chronic Disease"", an academic journal published by the Centers for Disease Control and Prevention (CDC) for more than 2 decades, have been told they’re being terminated, leaving the publication’s future uncertain. ",https://www.science.org/content/article/exclusive-future-chronic-disease-journal-limbo-after-cuts-cdc,No,Yes,No,No,Yes,No,No,No,No,No
1671,2025-10-30,"The senior head of a Navy office that helps organize critical research and funding for the service has been replaced by a 33-year-old former Department of Government Efficiency (DOGE) employee . His replacement is highly unusual given that the office — created by Congress in 1946 to fund Navy and Marine Corps research — is typically run by a two-star admiral with extensive experience in technology, science, and engineering.",https://thehill.com/policy/defense/5581695-navy-chief-research-replaced/,No,Yes,No,No,Yes,No,No,No,No,No
1657,2025-10-29,"Radio Free Asia, one of four federally funded news organizations the Trump administration has aimed to close, will shut down its news operations at the end of October. The news group’s expected closure can be attributed to the Trump administration’s broad efforts to cut federal funding, and to the government shutdown ",https://www.nytimes.com/2025/10/29/us/politics/radio-free-asia-close.html,No,Yes,No,Yes,No,Yes,No,No,No,No
1656,2025-10-29,Donald Trump has fired all six members of an independent federal agency responsible for reviewing his controversial White House ballroom and planned “Arc de Trump” in Washington DC. The White House says it will appoint new Commission of Fine Arts members ‘more aligned with … America First Policies’,https://www.theguardian.com/us-news/2025/oct/29/trump-fires-arts-board-arc-ballroom,No,No,No,Yes,No,Yes,No,No,No,No
1653,2025-10-28,Health Secretary RFK Jr asks Centers for Disease Control and Prevention (CDC) to study alleged harms of offshore wind farms,https://www.reuters.com/business/healthcare-pharmaceuticals/rfk-jr-directs-cdc-study-alleged-harms-offshore-wind-farms-bloomberg-news-2025-10-28/,No,No,No,No,Yes,No,No,No,No,No
1645,2025-10-28,"Texas Attorney Tim Paxton sues Tylenol makers, accusing them of knowingly hiding the drug's links to autism and attention deficit hyperactivity disorder. There is no good evidence that tylenol (paracetamol) is linked to autism or ADHD",https://www.reuters.com/world/texas-sues-jj-kenvue-claiming-they-hid-tylenols-autism-risks-2025-10-28/,No,No,No,No,Yes,No,No,No,No,No
1637,2025-10-27,"Threat to US vaccines as entire staff supporting Advisory Committee on Immunization Practices (ACIP) were let go as well as its Ethics and CDC's Human Resources department. This is according to former Chief Medical Officer Debra Houry and Demetre Daskalakis, former director of the National Center for Immunization and Respiratory Diseases who spoke at. a press conference ",https://www.theguardian.com/us-news/2025/oct/27/vaccines-rfk-jr-cdc-acip-panel,No,Yes,No,No,Yes,No,No,No,No,No
1632,2025-10-26,"Trump on social media gives new warning on pregnant women taking Tylenol (Paracetamol), or giving Tylenol to their children. He also said parents should split vaccination visits for many childhood vaccines. There is no evidence for harm for Tylenol or combine vaccines. More visits will reduce uptake, and for some diseases the combined vaccines are more effective than single shots.",https://thehill.com/policy/healthcare/5574211-trump-vaccine-acetaminophen-pregnancy/,No,No,No,Yes,Yes,No,No,No,No,No
1622,2025-10-25,"Health secretary RFK Jr (Kennedy) to urge American to eat more saturated fats, contradicting decades of dietary guidelines ",https://www.theguardian.com/us-news/2025/oct/25/rfk-jr-saturated-fats,No,No,No,Yes,Yes,No,No,No,No,No
1613,2025-10-24,Trump reverses Biden-era rule on copper smelters - the rule had imposed stricter limits on emissions.,https://www.reuters.com/sustainability/climate-energy/trump-reverses-biden-era-rules-copper-smelters-2025-10-24/,No,No,No,No,Yes,No,No,No,No,No
1608,2025-10-23,"Trump administration announced a plan to allow oil and gas drilling in Alaska’s Arctic National Wildlife Refuge, one of the largest remaining tracts of pristine wilderness in the United States. In addition the Interior Department said it would hold an oil and gas lease sale in the coastal plain as soon as this winter.",https://www.nytimes.com/2025/10/23/climate/trump-arctic-national-wildlife-refuge-oil-drilling.html,No,No,No,No,Yes,No,No,No,No,No
1597,2025-10-22,"The University of Virginia has reached a deal with adminstration to end investigations against it and restore funding. It agreed to be bound by federal guidance forbidding racial discrimination in admission and hiring, as described by the Justice Department. It also agreed to provide relevant data on a quarterly basis through 2028. The president will have to personally certify that the university is in compliance each quarter",https://www.pbs.org/newshour/education/university-of-virginia-strikes-deal-with-trump-administration-to-pause-civil-rights-investigations,No,No,No,No,No,Yes,No,No,No,No
1595,2025-10-22,Trump demolishes the entire historic White House East Wing to make room for new ballroom. Trump initially said the construction would not touch the East Wing or “interfere with the current building.” ,https://www.nytimes.com/2025/10/22/us/politics/east-wing-white-house-demolition-trump.html,Yes,No,No,Yes,No,Yes,No,No,No,No
1592,2025-10-22,US demands EU reverse its climate and human rights rules in order to allow greater imports of liquefied natural gas (LNG),https://www.theguardian.com/us-news/2025/oct/22/us-eu-climate-rules-lng-gas,No,No,No,No,Yes,No,No,No,Yes,No
1581,2025-10-21,"More than 420 anti-science bills attacking longstanding public health protections – vaccines, milk safety and fluoride – have been introduced in statehouses across the U.S. this year, part of an organized, politically savvy campaign to enshrine a conspiracy theory-driven agenda into law. the wave of legislation has cropped up in most states, pushed by people with close ties to Health and Human Services Secretary Robert F. Kennedy Jr.",https://apnews.com/article/vaccines-fluoride-kennedy-trump-science-antiscience-legislation-73af8e65f407331e8f31b2909812a004,No,No,No,No,Yes,No,No,No,No,No
1565,2025-10-18,"The US Senate is poised to approve Donald Trump’s nomination of an industry lobbyist to lead the Environmental Protection Agency’s (EPA) chemical safety office. If confirmed, the top four toxics office positions at the EPA will be held by former chemical industry lobbyists, raising new fears about the health and safety of the American public",https://www.theguardian.com/us-news/2025/oct/18/senate-epa-confirmation-douglas-troutman-lobbyist,Yes,No,No,No,Yes,No,No,Yes,No,No
1554,2025-10-17,US blocks a global fee on shipping emissions as international meeting ends without new regulations,https://apnews.com/article/shipping-climate-change-carbon-fee-a5f854e7028d08035689db50814a6519,No,No,No,No,Yes,No,No,No,Yes,No
1531,2025-10-15,"National Snow and Ice Data Center (NSIDC) announced suspension or reduction of several tools, services and report due to its funding not being renewed by the Administration. These data are important for tracking climate change.",https://nsidc.org/data/user-resources/data-announcements/user-notice-sea-ice-today-services-reduced,No,No,No,No,Yes,No,No,No,No,No
1529,2025-10-14,"A quarter of the CDC workforce has been fired or has resigned since January 2025. Another round of terminations, combined with previous layoffs and departures, has reduced the Centers for Disease Control and Prevention workforce by about 3,000 people since January.",https://www.wired.com/story/cdc-terminations-workforce-shutdown-rifs/,No,Yes,No,No,Yes,No,No,No,No,No
1526,2025-10-14,"Trump expands preferential funding offer to all US colleges. The Compact agreement would grant preferential funding in return for a slew of commitments including DEI bans and a 15% cap on colleges’ international undergraduate students. [This was initially sent to 9 unis, MIT rejected it]",https://thepienews.com/trump-expands-preferential-funding-offer-to-all-us-colleges/,No,No,No,No,No,Yes,No,No,No,No
1520,2025-10-13,"Although almost half of the 1300 CDC lay-offs have been rescinded, around 600 remain fired. This include around 100 who were working at the National Center for Health Statistics and a team that is part of the day-to-day operations for the National Health and Nutrition Examination Survey",https://www.washingtonpost.com/health/2025/10/13/cdc-layoffs-reversed-aspr-samhsa/,No,No,No,No,Yes,No,No,No,No,No
1515,2025-10-13,"Dept of Education (DoE) lays off majority of special education staff including in the Office of Special Education and Rehabilitative Services, which oversees programs that support millions of children and adults with disabilities nationwide",https://www.theguardian.com/us-news/2025/oct/13/special-education-department-layoffs,No,Yes,No,No,No,Yes,No,No,No,No
1505,2025-10-10,"RFK Jr during a cabinet meeting acknowledged that here is no proof to his alleged links with Tylenol and autism, but then proceeded to say ""we're doing the studies to make the proof'",https://ca.news.yahoo.com/3-words-rfk-jr-medical-070113947.html,No,No,No,No,Yes,No,No,No,No,No
1501,2025-10-10,"Trump administration lays off CDC staff, including high-ranking scientists, the entire Washington office, 70 Epidemic Intelligence Service staff and the entire staff of the weekly publication Morbidity and Mortality Weekly Report. It reinstated many of them 2 days later",https://www.nytimes.com/2025/10/11/us/politics/trump-administration-cdc-layoffs.html,No,Yes,No,No,Yes,No,No,No,No,No
1498,2025-10-10,The Trump administration has killed a massive proposed solar power project in Nevada that would have been one of the largest in the world,https://www.theguardian.com/us-news/2025/oct/10/trump-officials-drop-major-solar-power-project-in-another-renewable-energy-attack,No,No,No,No,Yes,No,No,No,No,No
1493,2025-10-09,"RFK Jr links autism to circumcised boys being given tylenol after circumcision. Scientists say ""studies have found no credible evidence linking Tylenol or circumcision to autism.""",https://www.newsweek.com/rfk-jr-autism-tylenol-autism-circumcision-children-boys-10854902,No,No,No,Yes,Yes,No,No,No,No,No
1487,2025-10-09,"Jim O'Neill, deputy secretary of the Dept of Health and Human Services (HHS) and acting director of the US Centers for Disease Control and Prevention (CDC) called for new monovalent vaccines to replace the combined MMR vaccine.",https://www.theguardian.com/us-news/2025/oct/09/cdc-separate-mmr-vaccines,No,No,No,No,Yes,No,No,No,No,No
1479,2025-10-08,US demands EU dismantle green regulations in threat to trade deal,https://www.ft.com/content/678f7c25-2eff-4e98-9c7c-e0772fa69236,No,No,No,No,Yes,No,No,No,Yes,No
1474,2025-10-07,"Trump administration considers cutting billions in funds from list of clean energy projects, including awards for auto manufacturing and carbon capture",https://www.reuters.com/sustainability/climate-energy/trump-administration-mulls-additional-12-billion-clean-energy-funding-cut-2025-10-07/,No,No,No,No,Yes,No,No,No,No,No
1471,2025-10-07,"Trump orders approval of 211-mile mining road through Alaska wilderness to allow mining of copper, cobalt, gold and other minerals. - this was previously blocked by the Biden administration and would harm wildlife and indigenous tribes",https://www.theguardian.com/us-news/2025/oct/06/trump-alaska-mining-road,No,No,No,No,Yes,No,No,No,No,No
1467,2025-10-06,"CDC removes support for COVID-19 booster, backing RFK Jr's hand-picked advisory panel (ACIP), saying they should be administered through shared decision-making with a healthcare provider. In addition the recommendations AGAINST the use of the combined measles-mumps-rubella-varicella (MMRV) vaccine before the age of 4 years were also signed off.",https://www.cnbc.com/2025/10/06/cdc-pulls-broad-support-for-covid-shot.html,No,No,No,No,Yes,No,No,No,No,No
1439,2025-10-03,Health Secretary RFK Jr fires top NIH scientist weeks after she filed a whistleblower complaint about the administrations' hostility towards vaccines,https://www.theguardian.com/us-news/2025/oct/03/rfk-jr-jeanne-marrazzo-nih-fired,No,No,Yes,No,Yes,No,No,No,No,No
1432,2025-10-02,"The White House issued a press release with links to scientific studies to back up Trump’s claim that use of Tylenol during pregnancy causes autism, but experts say those studies do not support the claim",https://www.theguardian.com/us-news/2025/oct/02/trump-tylenol-autism-expert-analysis,No,No,No,Yes,Yes,No,No,No,No,No
1429,2025-10-02,"CDC still hasn't issued covid vaccine guidance following the vaccine committee meeting. This is highly unusual as normally CDC guidance is updated within hours of the meeting, and leaves people in limbo unable to get their booster shots",https://www.npr.org/sections/shots-health-news/2025/10/02/nx-s1-5559439/cdc-covid-vaccine-guidelines,No,No,No,No,Yes,No,No,No,No,No
1422,2025-10-02,"The White House sent letters to nine of the nation’s top public and private universities, urging campus leaders to pledge support for President Trump’s political agenda to help ensure access to federal research funds",https://www.nytimes.com/2025/10/02/us/politics/trump-college-funding.html,No,No,No,No,No,Yes,No,Yes,No,No
1419,2025-10-01,"President Donald Trump's administration is cancelling nearly $8 billion in climate-related funding targeting 16 U.S. states, including California and New York, White House budget director Russ Vought said, following through on threats to use the shutdown to punish Democrat states",https://www.reuters.com/sustainability/cop/trump-administration-scraps-8-billion-climate-related-projects-2025-10-01/,No,No,Yes,No,Yes,No,No,No,No,No
1418,2025-10-01,"The White House abruptly fired a large share of the council members advising the National Endowment for the Humanities, retaining only four appointees of President Donald Trump. A White House spokesperson told The Post in an email that the president is “hoping to place members on the board who align more closely with his vision.”",https://www.washingtonpost.com/entertainment/2025/10/01/national-council-on-the-humanities-fired-white-house/,No,Yes,No,No,No,Yes,No,No,No,No
1412,2025-09-30,Dept of Justice launches investigation into Des Moines (Iowa) public schools system over race-based hiring practices and DEI policies. Last week its superintendent was arrested,https://www.reuters.com/legal/litigation/us-justice-department-probes-des-moines-schools-race-based-hiring-practices-2025-09-30/,No,No,Yes,No,No,Yes,Yes,No,No,No
1411,2025-09-30,President Donald Trump said that his administration had reached a deal with Harvard University after months of negotiations and that the Ivy League school will pay $500 million.,https://www.reuters.com/world/us/trump-says-us-government-reached-deal-with-harvard-university-2025-09-30/,No,No,No,No,No,Yes,No,No,No,No
1410,2025-09-30,"The White House is canceling millions of dollars that dozens of universities use to research food production, despite budget chief Russ Vought’s promise to leave that money untouched.",https://www.politico.com/live-updates/2025/09/30/congress/trump-vought-cancel-food-research-funding-congress-00588358,No,Yes,No,No,Yes,No,No,No,No,No
1405,2025-09-30,"Dept of Energy tells staff at the Office of Energy Efficiency and Renewable Energy to stop using terms including “climate change”, “decarbonization”, “sustainable”, “emissions” and “green”. Also on the list are “energy transition”, “‘clean’ or ‘dirty’ energy” and “carbon/CO2 ‘Footprint’”.",https://www.theguardian.com/us-news/2025/sep/30/energy-department-climate-change-crisis-language,No,No,No,Yes,Yes,No,No,No,No,No
1398,2025-09-30,"Schools, food banks and other organizations are rushing to wind down nutrition and health programming once funded by the U.S. Department of Agriculture's Supplemental Nutrition Assistance Program Education, known as SNAP-Ed. The program was eliminated by Trump's spending bill, effective September 30.",https://www.reuters.com/world/us/states-end-nutrition-education-programs-after-trump-cuts-2025-09-30/,No,Yes,No,No,Yes,Yes,No,No,Yes,No
1393,2025-09-29,California State University System (CSU) faces antisemitism complaint filed by the Trump administration,https://www.reuters.com/legal/government/california-state-university-system-faces-federal-probe-by-trump-administration-2025-09-30/,No,No,Yes,No,No,Yes,No,No,No,No
1392,2025-09-29,"Dept of Health and Human Services refers Harvard for administrative suspension and debarment proceedings, seeking federal funding ineligibility",https://www.reuters.com/legal/government/trump-administration-seeks-make-harvard-ineligible-federal-funding-2025-09-29/,No,No,No,No,No,Yes,No,No,No,No
1387,2025-09-29,Trump administration to expand coal mine leasing on 13.1 million acres of federal land to support more coal powered energy generation,https://www.nytimes.com/live/2025/09/29/us/trump-news-shutdown#trump-coal-revival,No,No,No,No,Yes,No,No,No,No,No
1360,2025-09-26,"US refuses to back UN declaration on noncommunicable diseases. General assembly backs new targets on cancer, diabetes and heart disease but Robert F Kennedy Jr objects, citing abortion and 'gender ideology' despite these not being in the declaration",https://www.theguardian.com/society/2025/sep/26/us-refuses-to-support-un-health-declaration-on-noncommunicable-diseases,No,No,No,No,Yes,No,No,No,Yes,No
1353,2025-09-25,the U.S. National Science Foundation (NSF) which funds a prestigious Graduate Research Fellowship Program has stopped 2nd year PhD students being eligible. and narrowed the application timeline. Awarded fellowshops will align with administration priorities.,https://www.science.org/content/article/completely-shattered-changes-nsf-s-graduate-student-fellowship-spur-outcry,No,No,No,No,Yes,No,No,No,No,No
1352,2025-09-25,"Acadia National Park removes educational signs about climate change, Indigenous history",https://www.mainepublic.org/climate/2025-09-25/acadia-national-park-removes-educational-signs-about-climate-change-indigenous-history,No,No,No,Yes,Yes,Yes,Yes,No,No,No
1349,2025-09-25,US health secretary Kennedy considers adding autism symptoms to vaccine injury program,https://www.reuters.com/business/healthcare-pharmaceuticals/us-health-secretary-kennedy-considers-adding-autism-symptoms-vaccine-injury-2025-09-25/,No,No,No,No,Yes,No,No,No,No,No
1340,2025-09-24,"Trump energy secretary Chris Right to return billions set aside for green projects, stating climate accords have not lowered emissions",https://www.theguardian.com/us-news/2025/sep/24/trump-energy-secretary-chris-wright,No,No,No,No,Yes,No,No,No,No,No
1329,2025-09-22,"Trump suggests changes to childhood vaccine schedule should be ""based on what I feel""",https://thehill.com/policy/healthcare/5516749-trump-vaccine-suggestions-autism-links/,No,No,No,No,Yes,No,No,No,No,No
1326,2025-09-22,"Trump administration ignores science and links autism to painkiller acetaminophen (Tylenol, paracetamol), urging pregnanat people not to use it. Trump also promotes many other false claims about vaccines",https://www.nytimes.com/2025/09/22/health/kennedy-autism-tylenol-trump.html,No,No,No,No,Yes,No,No,No,No,No
1316,2025-09-20,"Scientists at the Environmental Protection Agency’s Office of Water, which ensures drinking water is safe, have been instructed by Trump officials to halt publishing ongoing research in an “unprecedented” move",https://www.independent.co.uk/news/world/americas/us-politics/trump-epa-scientists-water-research-b2830523.html,No,No,No,Yes,Yes,No,No,No,No,No
1310,2025-09-20,"The Trump administration ends government’s annual report on hunger in America, stating that it had become “overly politicized” and “rife with inaccuracies.”. The decision comes two and a half months after Trump signed legislation sharply reducing food aid to the poor.",https://apnews.com/article/trump-ending-america-hunger-report-snap-cuts-750f90757f50ab2d8bc97dfca5a917dd,Yes,No,No,Yes,Yes,No,No,No,No,No
1308,2025-09-19,Oklahoma proposing a law that requires every higher education institution in the state to create a Charlie Kirk Memorial Plaza with statue,https://www.theguardian.com/us-news/2025/sep/20/oklahoma-republicans-charlie-kirk,No,No,No,No,No,Yes,No,No,No,Yes
1295,2025-09-19,"President Donald Trump's administration escalated its campaign against Harvard University by placing new restrictions on the Ivy League school's ability to access federal funds for student aid, citing concerns about the ""financial position"" of the oldest and richest university in the United States.",https://www.reuters.com/world/us/us-education-dept-raises-financial-responsibility-concerns-about-harvard-2025-09-19/,No,No,No,No,No,Yes,No,No,No,No
1294,2025-09-19,A panel of U.S. vaccine advisers named by Health Secretary Robert F. Kennedy Jr. on Friday abandoned years of broad support for the COVID-19 shot and recommended that the vaccines be made available for all ages based on shared clinical decision-making with a physician,https://www.reuters.com/business/healthcare-pharmaceuticals/us-vaccine-advisers-resume-meeting-with-hepatitis-b-covid-votes-ahead-2025-09-19/,No,No,No,No,Yes,No,No,No,No,No
1285,2025-09-18,"The Trump administration is changing how and where the U.S. government delivers health aid around the world, breaking decades of practice to bypass nongovernmental organizations and prioritize the Western Hemisphere and Asia Pacific regions over Africa",https://www.nytimes.com/2025/09/18/us/politics/us-aid-health-ngos.html,No,No,No,No,Yes,No,No,No,Yes,No
1278,2025-09-17,"Dept of Education (DoE) to prioritse ""patriotic education"" in discretionary grants",https://www.reuters.com/world/us/trump-administration-prioritize-patriotic-education-discretionary-grants-2025-09-18/,No,No,No,Yes,No,Yes,No,No,No,No
1271,2025-09-17,"U.S. government lawyers attempted to block a vaccine skeptic appointed by Health Secretary Robert F. Kennedy, Jr. from assuming new powers at the Centers for Disease Control and Prevention that could be used to restrict access to COVID-19 shots. Their advice was overridden.",https://www.reuters.com/legal/litigation/government-lawyers-objected-new-powers-kennedys-covid-vaccine-adviser-2025-09-17/,Yes,No,No,No,Yes,No,No,No,No,No
1266,2025-09-16,"US Interior Dept states all interpretive signage in National Parks are under review and the Washington Post reported that it has ordered the removal of signs and exhibits related to slavery at multiple national parks, including a historic photograph of a formerly enslaved man showing scars on his back.",https://www.reuters.com/world/us/trump-administration-says-all-interpretive-signage-national-parks-under-review-2025-09-16/,No,No,No,Yes,No,Yes,No,No,No,No
1263,2025-09-16,"Cuts at the Centers for Disease Control (CDC) forced Mississippi data collection for Pregnancy Risk Assessment Monitoring System (Prams), a national database that has been integral to policymaking on maternal and infant health for nearly four decades. Mississippi has just declared an infant deaths emergency.",https://www.theguardian.com/us-news/2025/sep/16/mississippi-infant-deaths-cdc-prams,No,No,No,No,Yes,No,No,No,No,No
1255,2025-09-15,"Dept of Health and Human Services (HHS) names 5 new ACIP members, of which at least three are COVID-19 vaccine critics",https://www.cidrap.umn.edu/public-health/hhs-names-5-new-members-cdc-vaccine-advisory-board,No,No,No,No,Yes,No,No,No,No,No
1237,2025-09-12,University of California Berkeley shares 160 academic names with Trump administration in ‘McCarthy era’ move,https://www.theguardian.com/us-news/2025/sep/12/uc-berkeley-trump-administration-antisemitism,No,No,Yes,No,No,Yes,No,No,No,No
