1234,2025-09-12,"Environmental Protection Agency (EPA) to stop collecting emissions data from polluters, incl coal-burning power plants, oil refineries, steel mills and other industrial facilities across the country.",https://www.nytimes.com/2025/09/12/climate/epa-emissions-data-collection-halt.html,No,No,No,No,Yes,No,No,No,No,No
1231,2025-09-12,Trump officials to link COVID vaccination with rare child deaths,https://www.washingtonpost.com/health/2025/09/12/covid-vaccine-child-death-cdc/,No,No,No,No,Yes,No,No,No,No,No
1228,2025-09-11,Court allows Trump administration to end Planned Parenthood's Medicaid funding,https://www.reuters.com/world/court-allows-trump-administration-end-planned-parenthoods-medicaid-funding-2025-09-11/,No,No,No,No,Yes,No,No,No,No,No
1224,2025-09-11,"Dept of Education (DoE) revokes Minority-Serving Institution (MSI) funding for colleges with large minority student populations, claiming funding violated the law because it goes to institutions that “meet racial or ethnic quotas.”",https://thehill.com/homenews/education/5498182-trump-admin-grants-minority-student-population/,No,No,No,No,No,Yes,Yes,No,No,No
1223,2025-09-11,Judge allows Trump to cut more than $1 billion in National Science Foundation (NSF) grants,https://www.theguardian.com/us-news/2025/sep/11/trump-national-science-foundation-grants-ruling,No,No,No,No,Yes,No,No,No,No,No
1221,2025-09-10,"US treasury-led watchdog, The Financial Stability Oversight Council, disbands two climate advisory panels: the Climate-Related Financial Risk Committee and the Climate-Related Financial Risk Advisory Committee",https://www.reuters.com/legal/government/us-treasury-led-watchdog-dismantles-climate-advisory-panels-2025-09-10/,No,No,No,No,Yes,No,No,No,No,No
1217,2025-09-10,"Bureau of Land Management proposes to scrap Biden-era rule protecting public lands. This would prioritise public land for oil and gas drilling, mining and other industrial activities",https://www.nytimes.com/2025/09/10/climate/trump-public-lands-rule-biden.html,No,No,No,No,Yes,No,No,No,No,No
1216,2025-09-10,"Leaked docs show that worker at Hyundai plant who was detained in ICE raid had valid visa, but officials ""mandated' that he agree to be removed and deported to South Korea",https://www.theguardian.com/us-news/2025/sep/10/hyundai-factory-ice-raid-legal-visa,No,No,No,No,Yes,No,No,No,No,Yes
1213,2025-09-10,"Texas A&M University children's literature professor, dean of the college for art and science and the head of department were fired over gender content and pressure from Republican politicians including Gov Abbott",https://www.theguardian.com/us-news/2025/sep/10/texas-am-university-children-lit-professor-fired,No,No,Yes,No,Yes,Yes,No,No,No,No
1211,2025-09-09,Dept of Health and Human Services has put on ice a CDC project that would make information about dozens of infectious diseases available in near real time in a user friendly way to the public,https://www.medpagetoday.com/special-reports/exclusives/117385,No,No,No,Yes,Yes,No,No,No,No,No
1210,2025-09-09,Top health officials under U.S. Health and Human Services Secretary Robert F. Kennedy Jr. are compiling examples of harmful effects from COVID-19 vaccines on pregnant women to share with the public,https://www.reuters.com/business/healthcare-pharmaceuticals/us-health-officials-compiling-examples-covid-vaccine-harm-during-pregnancy-wsj-2025-09-10/,No,No,No,No,Yes,No,No,No,No,No
1197,2025-09-08,Trump shares video linking autism to vaccines on his Truth Social Media,https://www.nytimes.com/2025/09/08/us/politics/trump-shares-video-promoting-discredited-link-of-vaccines-to-autism.html,No,No,No,Yes,Yes,No,No,No,No,No
1171,2025-09-05,"Federal report on alcohol drinking withdrawn and to be replaced with US dietary guidelines, based on a competing report favoured by the alcohol industry, stating that moderate alcohol consumption is healthier than not drinking",https://www.nytimes.com/2025/09/05/health/alcohol-drinking-hhs-report.html,No,No,No,No,Yes,No,No,No,No,No
1164,2025-09-04,"RFK Jr hints that access to abortion drug mifepristone could be rolled back, claiming the Biden adminstration ""twisted"" the data. This is despite evidence from over 100 studies that it is safe and effective.",https://www.theguardian.com/us-news/2025/sep/04/trump-rfk-mifepristone-abortion-pill,No,No,No,Yes,Yes,No,No,No,No,No
1163,2025-09-04,"Ousted CDC director Susan Monarez states that she was fired after refusing to comply with RFK Jrs ""troubling directives"", including to preapprove the recommendations of a “vaccine advisory panel newly filled with people who have publicly expressed antivaccine rhetoric.”",https://www.wsj.com/opinion/robert-f-kennedy-jr-the-cdc-and-me-b4ca2eaa,No,No,Yes,No,Yes,No,No,No,No,No
1160,2025-09-04,Department of Justice considering to ban trans people from buying guns - this follows a shooting at a school in Minnesota,https://www.reuters.com/world/us/trump-administration-considering-banning-trans-people-buying-guns-us-media-2025-09-04/,No,No,No,No,Yes,No,Yes,No,No,No
1157,2025-09-03,New NIH funding rules shift decision-making power from peer review panels to political appointees in determining future scientific grants.,https://conexiant.com/infectious-disease/articles/policy-shift-adjusts-nih-peer-review-role,No,No,No,No,Yes,No,No,No,No,No
1156,2025-09-03,"Vinay Prasad, the Food and Drug Administration's (FDA) top vaccine official overuled scientists on wider access to COVID-19 shots",https://www.nytimes.com/2025/09/04/us/politics/hhs-vaccines-poll-harrisx-trump-rfk.html,No,No,No,No,Yes,No,No,No,No,No
1154,2025-09-03,Trump targets another off-shore wind project for cancellation (New England 1 and 2),https://thehill.com/policy/energy-environment/5484952-trump-offshore-wind-farms/,No,No,No,No,Yes,No,No,No,No,No
1149,2025-09-03,FDA questions safety of receiving COVID-19 and flu shot together despite no evidence of harm,https://www.washingtonpost.com/health/2025/09/03/vaccine-access-covid-flu-fda-safety/,No,No,No,Yes,Yes,No,No,No,No,No
1141,2025-09-02,"Paul Offit, an outspoken critic of Trump and his administration is dismissed from FDA vaccine panel",https://edition.cnn.com/2025/09/02/health/offit-fda-vrbpac,No,No,Yes,No,Yes,No,No,No,No,No
1138,2025-09-02,"Dept of Energy's (DoE) contentious climate report (complied by five hand-picked fringe researchers) criticised by 85 top climate scientsts as biased, riddled with errors and failing basic scientific credibility.",https://www.theguardian.com/us-news/2025/sep/02/trump-administration-climate-report,No,No,No,No,Yes,No,No,No,No,No
1133,2025-09-01,Previous CDC directors write a public article in the New York Times warning that Kennedy (JFK Jr) is endangering the health of Americans,https://www.nytimes.com/2025/09/01/opinion/cdc-leaders-kennedy.html,No,No,No,No,Yes,No,No,No,No,No
1132,2025-09-01,Donald Trump on Monday called on pharmaceutical companies to justify the success of their drugs intended to treat COVID. Trump said there is disagreement on whether the drugs saved lives but the scientific consensus and evidence is clear that they have saved millions of lives.,https://www.reuters.com/business/healthcare-pharmaceuticals/trump-calls-pharmaceutical-companies-justify-success-covid-drugs-2025-09-01/,No,No,No,Yes,Yes,No,No,No,No,No
1126,2025-08-31,Possible changes to the National Vaccine Injury Compensation Program (VICP) by RFK Jr might threaten vaccine availability,https://www.theguardian.com/us-news/2025/aug/31/rfk-jr-vaccine-injury-compensation,No,No,No,No,Yes,No,No,No,No,No
1125,2025-08-31,FDA's top vaccine regulator Vinay Prasad requests removal of youtube videos of him criticising COVID-19 vaccines,https://www.theguardian.com/us-news/2025/aug/31/fda-official-youtube-videos,No,No,No,Yes,Yes,No,No,No,No,No
1121,2025-08-30,"Demetre Daskalakis, recently resigned director of the National Center for Immunization and Respiratory Diseases in the Centers for Disease Control (CDC), said"" No one from my center has ever briefed [Kennedy (RFK)] on any of those topics … He’s getting information from somewhere, but that information is not coming from CDC expert""",https://www.theguardian.com/us-news/2025/aug/28/rfk-resign-cdc-susan-monarez-fired,No,No,No,No,Yes,No,No,No,No,No
1117,2025-08-29,Trump cancelling $679 billion in federal funding on off-shore wind projects - U.S. Transportation Secretary Sean Duffy announced that the department was cancelling or terminating awards made under the Biden administration.,https://www.reuters.com/sustainability/climate-energy/trump-cancelling-679-million-federal-funding-offshore-wind-projects-2025-08-29/,No,No,No,No,Yes,No,No,No,No,No
1116,2025-08-29,"The White House replaces fired CDC chief Monarez with O'Neill, a former investment executive with no medical or scientific background. He is currently RFK Jr's (Kennedy) deputy at Health at Human Services",https://www.theguardian.com/us-news/2025/aug/28/cdc-chief-fired-white-house-monarez-trump,No,No,No,No,Yes,No,No,No,No,No
1115,2025-08-29,"RFK Jr. (Kennedy) Blames Gun Violence on Antidepressants After Minneapolis School Shooting: 'We're Launching Studies'. Robert F. Kennedy Jr. claimed SSRI (anti-depressant) medications carry warnings of homicidal thoughts, which mental health experts say is not true",https://people.com/rfk-jr-blames-gun-violence-on-antidepressants-11800552,No,No,No,Yes,Yes,No,No,No,No,No
1113,2025-08-29,"New Trump rule to ban doctors from the US Dept of Veteran Affairs (VA) to perform abortions, even in case of incest or rape",https://www.theguardian.com/us-news/2025/aug/29/trump-veterans-affairs-abortion-ban,No,No,No,No,Yes,No,Yes,No,No,No
1102,2025-08-28,"The Pediatric Brain Tumor Consortium, an association of 16 academic centers and children’s hospitals dedicated to trials of novel treatments for pediatric brain cancer, is halting enrollment in clinical trials for children with brain cancer after the federal government said it would no longer provide funding to the group.",https://www.nytimes.com/2025/08/28/well/pediatric-brain-cancer-trial-group.html,No,No,No,No,Yes,No,No,No,No,No
1100,2025-08-28,The Centers for Disease Control and Prevention (CDC) has scaled back a federal-state surveillance program for foodborne pathogens.,https://www.cidrap.umn.edu/foodborne-disease/cdc-cuts-back-foodborne-illness-surveillance-program,No,No,No,No,Yes,No,No,No,No,No
1099,2025-08-28,"RFK Jr (Kennedy) and White House say that Centers for Disease Control and Prevention (CDC) have to align with MAHA agenda and accept recommendations from new vaccine panel members, handpicked by Kennedy (ACIP)",https://thehill.com/policy/healthcare/5475599-trump-administration-overhauls-cdc/,No,No,No,No,Yes,No,No,No,No,No
1095,2025-08-28,Dept of Education (DoE) threatens to pull federal funding from Denver schools for violating students’ civil rights by providing gender-neutral bathroom facilities and letting transgender students use bathrooms that align with their gender identity. Schools have 10 days to comply,https://www.nytimes.com/2025/08/28/us/politics/trump-denver-schools-transgender-bathrooms.html,No,No,No,No,No,Yes,Yes,No,No,No
1093,2025-08-27,"White House fires new Centers for Disease Control and Prevention (CDC) director Susan Monarez, after she refused to resign ; three senior CDC offiials resigned immediately after over ""weaponizing of public health""",https://www.bbc.co.uk/news/articles/cwy3zjxy3dwo,No,No,Yes,No,Yes,No,No,No,No,No
1092,2025-08-27,"US Dept of Justice (DoJ) opens investigation into California's Environmental Protection Agency, aiming to determine if it ""may be engaged in employment practices that discriminate based on race, sex, color, or national origin,""",https://www.reuters.com/legal/government/us-justice-dept-investigating-californias-environmental-agency-2025-08-27/,Yes,No,Yes,No,Yes,No,Yes,No,No,No
1087,2025-08-27,Trump administration moves to tighten duration of visas for students and media,https://www.reuters.com/business/media-telecom/trump-administration-moves-tighten-duration-visas-students-media-2025-08-27/,No,No,No,No,No,Yes,No,No,Yes,No
1080,2025-08-26,"University of Michigan Hospital ends gender-affirming care for minors, citing federal pressure. The decision comes after the University received a subpoena from the Department of Justice",https://www.michiganpublic.org/health/2025-08-26/u-of-m-ends-gender-affirming-care-for-minors-citing-federal-pressure,No,No,No,No,Yes,No,Yes,No,No,No
1077,2025-08-26,Trump says he wants ‘nothing less than $500m’ from Harvard as a condition for restoring billions of dollars in federal funding,https://www.theguardian.com/education/2025/aug/26/trump-harvard-feud,No,No,No,No,No,Yes,No,No,No,No
1075,2025-08-26,"The Federal Emergency Management Agency (FEMA) suspended around 30 employees after those workers wrote to Congress warning that the Trump administration had gutted the nation’s ability to handle hurricanes, floods and other extreme weather disasters.",https://www.nytimes.com/2025/08/26/climate/fema-suspends-staff-who-criticized-trump-cuts.html,Yes,No,Yes,No,Yes,No,No,No,No,No
1073,2025-08-26,"Federal agencies including departments of defense (DoD) and energy and commerce to work together to review offshore wind farms approved by the Biden administration, according to RFK Jr.",https://www.reuters.com/sustainability/climate-energy/trump-agencies-team-up-review-offshore-wind-kennedy-says-2025-08-26/,No,No,No,No,Yes,No,No,No,No,No
1070,2025-08-26,"Department of Health and Human Services (HHS) asks 46 states/territories to remove all references to ""gender ideology"" from federally funded sex ed program. States aree given 60 days to revise materials",https://www.reuters.com/legal/litigation/hhs-asks-46-states-territories-remove-gender-ideology-content-sex-ed-materials-2025-08-26/,No,No,No,No,Yes,No,Yes,No,No,No
1068,2025-08-25,"US CDC taps vaccine skeptic, Retsef Levi, to lead its COVID vaccine workgroup. Retsef Levi had critiqued mRNA vaccines in the past, saying they can cause serious harm and death, especially among children, and called for their immediate withdrawal.",https://www.reuters.com/business/healthcare-pharmaceuticals/us-cdc-taps-vaccine-skeptic-lead-covid-vaccine-committee-2025-08-25/,No,No,No,No,Yes,No,No,No,No,No
1060,2025-08-25,"Trump administration pushes ahead with National Oceanic and Atmospheric Administration (NOAA) and weather cuts, despite congressional resistance",https://www.science.org/content/article/trump-administration-pushes-ahead-noaa-climate-and-weather-cuts,No,No,No,No,Yes,No,No,No,No,No
1057,2025-08-25,"President Donald Trump and Health and Human Services Secretary Robert F. Kennedy Jr. (RFK) are allegedly planning to ban the COVID vaccine ""within months,"" according to an associate of Kennedy's.",https://www.newsweek.com/donald-trump-rfk-covid-vaccine-hhs-2118816,No,No,No,No,Yes,No,No,No,No,No
1055,2025-08-25,"Kennedy Center's new director of Dance critisises ballet culture as ""woke"" and complained about ""radically leftist ideologies in ballet""",https://www.nytimes.com/2025/08/25/arts/dance/kennedy-center-stephen-nakagawa.html,No,No,No,No,No,Yes,No,No,No,No
1049,2025-08-23,"The Trump administration (Dept of Justice, DOJ) said it will not defend a decades-old grant program for colleges with large numbers of Hispanic students that is being challenged in court, declaring the government believes the funding is unconstitutional.",https://www.msn.com/en-gb/news/uknews/justice-department-won-t-defend-grants-for-hispanic-serving-colleges-calling-them-unconstitutional/ar-AA1L3buy,Yes,No,No,No,No,Yes,Yes,No,No,Yes
1040,2025-08-22,Trump rolls back rules meant to keep politics out of climate research,https://www.msn.com/en-us/news/politics/trump-rolls-back-rules-meant-to-keep-politics-out-of-climate-research/ar-AA1L2Wgc,No,No,No,No,Yes,No,No,No,No,No
1037,2025-08-22,"Trump administration's Bureau of Ocean Management (BOEM) halts off-shore wind project in Rhode Island. The Revolution Wind Project, a $1.5 billion plan, approved under former President Biden is 80 percent complete and projected to be finished by 2026, according to Ørsted. The company says it’s “fully permitted, having secured all required federal and state permits.”",https://thehill.com/policy/energy-environment/5467000-trump-halts-rhode-island-wind-energy-project/,No,No,No,No,Yes,No,No,No,No,No
1034,2025-08-22,Kennedy Center fires dance director and two other dance programmers saying he had lost confidence in “the ability of the department as currently constituted to align with the priorities of the Kennedy Center.”,https://www.nytimes.com/2025/08/22/arts/dance/kennedy-center-dance-jane-raleigh.html,No,No,No,No,No,Yes,No,No,No,No
1027,2025-08-21,"White House Advisor Lindsey Halligan defending the administration's move to ""review"" Smithonian content stating an overemphasis on slavery",https://thehill.com/homenews/administration/5463220-trump-administration-defends-review-smithsonian-content/,No,No,No,Yes,No,Yes,No,No,No,No
1022,2025-08-21,"Trump administration rescinding federal guidance requiring schools to provide a broad range of services to students who are not proficient in English. These had been in place since 2015, and this will likely weaken support for immigrant children",https://www.nytimes.com/2025/08/21/us/politics/trump-administration-education-instructions-english-learners.html,No,No,No,No,No,Yes,Yes,No,No,Yes
1021,2025-08-21,"Trump administration cuts California grant for program designed to prevent teenage pregnancy and childhood sexually transmitted infections, saying the state refused to remove ""radical gender ideology"" from its curriculum.",https://www.reuters.com/world/us/trump-administration-cuts-california-grant-over-transgender-policies-2025-08-21/,No,No,No,No,Yes,No,Yes,No,No,No
1020,2025-08-21,"Supreme Court (SCOTUS) allows Trump administration to cut $783m in NIH funds in its push to cut federal diversity, equity and inclusion efforts",https://www.theguardian.com/us-news/2025/aug/21/supreme-court-trump-research-dei,No,No,No,No,Yes,No,Yes,No,No,No
1016,2025-08-21,"A coal-fired plant in Michigan was to close. But Trump forced it to keep running at $1m a day. The town had big plans for the facility site, until the Trump administration ordered it to stay open, a move it extended this week",https://www.theguardian.com/environment/2025/aug/21/jh-campbell-coal-power-plant-michigan-trump-administation,Yes,No,No,No,Yes,No,No,No,No,No
1008,2025-08-20,"RFK Jr attacks American Academy of Pediatrics over their vaccine recommendations, accusing the group of being part of a pay-to-play scheme to promote commercial ambitions of AAP’s big pharma benefactors",https://www.politico.com/news/2025/08/19/rfk-jr-attacks-pediatricians-covid-vaccine-recommendations-00515609,No,No,No,No,Yes,No,No,No,No,No
1004,2025-08-19,US Dept of Agriculture (USDA) limits funding for wind and solar energy on farmland,https://thehill.com/policy/energy-environment/5459631-usda-restricts-wind-solar-farms/,No,No,No,No,Yes,No,No,No,No,No
1000,2025-08-19,Trump attacks American museums for being 'too woke' and talking too much about slavery,https://www.nytimes.com/2025/08/19/us/politics/trump-smithsonian-slavery.html,No,No,No,Yes,No,Yes,No,No,No,No
993,2025-08-18,"US State Department revokes 6,000 student visas",https://www.bbc.co.uk/news/articles/cz93vznxd07o,No,No,No,No,No,Yes,No,No,No,Yes
990,2025-08-18,"Oklahoma to vet prospective teachers from New York And California with ""America First"" test. Teachers from California and New York to be grilled on such topics as ‘biological differences between males and females’",https://www.theguardian.com/us-news/2025/aug/18/oklahoma-teachers-america-first-test,No,No,No,Yes,No,Yes,No,No,No,No
984,2025-08-16,"A new wave of book bans has hit Florida school districts, with hundreds of titles being pulled from library and classroom shelves as the school year kicks off. The books taken off the school shelves included The Diary of Anne Frank and What Girls Are Made of.",https://www.theguardian.com/us-news/2025/aug/16/florida-new-book-bans,No,No,No,Yes,No,Yes,No,No,No,No
979,2025-08-15,Internal Revenue Service (IRS) issues new rules that restrict wind and solar projects to claim federal tax breaks,https://www.nytimes.com/2025/08/15/climate/irs-wind-solar-tax-credits.html,No,No,No,No,Yes,No,No,No,No,No
975,2025-08-14,"The Department of Health and Human Services (HHS) said it is reviving a long-defunct task force on the safety of childhood vaccines, responding to a demand from the anti-vaccine organization founded by HHS Secretary Robert F. Kennedy (RFK) Jr",https://thehill.com/policy/healthcare/5453022-hhs-revives-childhood-vaccine-task-force/,No,No,No,No,Yes,No,No,No,No,No
968,2025-08-14,"Acting NASA administratorSean Duffy says climate science will ""move aside"" and all focus at NASA will be on space exploration",https://thehill.com/policy/energy-environment/5453230-duffy-nasa-climate-science/,No,No,No,No,Yes,No,No,No,No,No
965,2025-08-13,Trump casts himself for Kennedy Center Honors - handpicking honorees and excluding those who are 'too woke',https://www.theguardian.com/us-news/2025/aug/13/donald-trump-kennedy-center-honors,No,No,No,No,No,Yes,No,No,No,No
962,2025-08-13,"NASA is planning to decommission premier (and fully functioning) satellite missions that gather information on planet-warming pollution and other climate vital signs as soon as October, marking the latest step by the Trump administration to scale back federal climate science.",https://edition.cnn.com/2025/08/13/climate/nasa-satellites-trump-budget-cuts-weather,No,No,No,No,Yes,No,No,No,No,No
961,2025-08-13,Federal Trade Commission (FTC) invalidates California emissions reduction agreement with truck manufacturers,https://thehill.com/policy/energy-environment/5450798-california-truck-emissions-ftc/,Yes,No,No,No,Yes,No,No,No,No,No
960,2025-08-13,Dept of Health and Human Services (HHS) orders Vaxart's mRNA COVID-19 vaccine trials to stop mid-trial as part of mRNA vaccine wind down,https://www.reuters.com/business/healthcare-pharmaceuticals/us-orders-vaxart-stop-covid-19-trial-amid-mrna-wind-down-2025-08-13/,No,No,No,No,Yes,No,No,No,No,No
958,2025-08-13,US Dept of Agriculture (USDA) moves to end union contracts for 6500 Food Safety Inspection Services (FSIS) and 150 Animal and Plant Health Inspection Services (APHIS),https://www.reuters.com/legal/litigation/usda-moves-end-employee-union-contracts-documents-show-2025-08-13/,No,Yes,No,No,Yes,No,Yes,No,No,No
957,2025-08-12,"White House announces comprehensive review of Smithsonian Museum exhibitions “to assess tone, historical framing and alignment with American ideals"", and “replacing divisive or ideologically driven language with unifying, historically accurate and constructive descriptions.”",https://www.nytimes.com/2025/08/12/arts/design/smithsonian-exhibitions-review-white-house-trump.html,No,No,No,Yes,No,Yes,No,No,No,No
956,2025-08-12,US to retaliate against International Maritime Organization (IMO) member countries that back IMO's net zero emissions plan for international shipping,https://www.reuters.com/sustainability/climate-energy/us-retaliate-against-imo-members-that-back-net-zero-emissions-plan-2025-08-12/,No,No,No,No,Yes,No,No,No,Yes,No
949,2025-08-12,Kennedy (RFK) Jr. contradicts law enforcement on CDC shooter motive claiming not enough was known about the motive (this is untrue),https://edition.cnn.com/2025/08/12/politics/video/rfk-jr-cdc-shooter-motive-digvid,No,No,No,Yes,Yes,No,No,No,No,No
947,2025-08-12,"Department of Justice (DOJ) says that George Washington University (GWU) violated federal civil rights laws by failing to take ""meaningful action"" against anti-semitism",https://www.theguardian.com/us-news/2025/aug/12/trump-administration-george-washington-university-civil-rights-law,No,No,No,No,No,Yes,No,No,No,No
941,2025-08-11,"National Institute of Health (NIH) Director, Bhattacharya , spreads vaccine Misinformation about Covid mRNA vaccines One Day After CDC Shooting [controlling information; attacking science/health]",https://www.importantcontext.news/p/nih-director-spreads-vaccine-misinformation,No,No,No,Yes,Yes,No,No,No,No,No
935,2025-08-08,"Trump signs executive order to tighten federal grant approvals, with grant award decisions to now undergo evaluation by Trump's political appointees",https://www.reuters.com/legal/government/trump-signs-executive-order-targeting-spending-grants-2025-08-08/,No,No,No,No,Yes,Yes,No,No,No,No
932,2025-08-08,"Trump administration threatens to take Harvard's patents in new escalation - ""Commerce Secretary Howard Lutnick is launching an ""immediate comprehensive review"" of whether Harvard has complied with federal laws around patents""",https://www.cbsnews.com/news/trump-administration-threatens-to-take-harvards-patents/,No,No,No,No,No,Yes,No,No,No,No
931,2025-08-08,Trump administration seeking $1 billion settlement from UCLA,https://us.cnn.com/2025/08/08/politics/ucla-trump-administration-settlement,No,No,No,No,No,Yes,No,No,No,No
929,2025-08-08,The Smithsonian National Museum of American History changes descriptions of Trump's role on Jan 6. it removed some details of the charges President Trump faced when it replaced a display about his two impeachments.,https://www.nytimes.com/2025/08/08/arts/design/smithsonian-trump-impeachment-jan-6.html,No,No,No,Yes,No,Yes,No,No,No,No
925,2025-08-08,Environmental Protection Agency (EPA) database helping companies calculate greenhouse emissions at risk of no longer being updated after its creator was suspended for criticising the Trump administration,https://www.nytimes.com/2025/08/08/climate/epa-database-useeio-greenhouse-gases.html,No,No,Yes,Yes,Yes,No,No,No,No,No
